questionID,Category,Gender,Question,Answer,correctAnswer,explanation63,weight,,"Of your daily energy requirement, what range does  the  basal metabolic rate (BMR) account for? ",20-40%; 40-70%; 70-80%; 80-95%,1,Your BMR accounts for anything between 40% and 70% of your body's daily energy requirements depending on your age and lifestyle. A Slow metabolism is more accurately described as a low BMR. 64,weight,,Which of the following can increase your metabolism?,green tea; black coffee; spice; energy drinks; none,4,"It is claimed that certain foods and drinks can boost your metabolism, including green tea, black coffee, spices and energy drinks. The evidence behind these claims is flimsy, the effect on your metabolism is marginal at best and each person will respond differently to each product. "65,weight,,How many lbs should you aim for a week when you are trying to lose weight?,0-1lb; 1-2lb; 2-3lb; 3-4lb,1,"If you're overweight, aim to lose about 5-10% of your starting weight by losing 0.5-1kg (1-2lb) a week. You should be able to lose this amount if you eat about 500 to 600 fewer calories than you need a day. An average man needs about 2,500 calories a day and an average woman about 2,000 calories to stay the same weight. "66,weight,,Which of the following is the most calorific?,blueberry muffin; flapjack; brownie; plain croissant; fruit scone,0,A blueberry muffin is the most calorific of the options provided at 355kcal. A fruit scone is a better option at around 195kcal.67,weight,,Which of the following coffee shop drinks contains the most calories? (All small sized and made with whole milk),cappuccino; latte; white coffee; mocha,3,A small mocha is the most calorific of the options provided at around 157kcal. A white coffee is only around 18kcal.68,weight,,Is it important to eat breakfast when you are trying to lose weight?,no; yes; makes no difference,1,"Some people skip breakfast because they think it will help them lose weight. In fact, research shows that eating breakfast can help people control their weight. A healthy breakfast is an important part of a balanced diet, and provides some of the vitamins and minerals we need for good health. Whole meal cereal, with fruit sliced over the top is a tasty and nutritious breakfast."69,weight,,How long does it take your stomach to tell your brain you are full?,10 minutes; 20 minutes; 30 minutes; 40 minutes; 60 minutes,1,"Eat slowly. It takes about 20 minutes for your stomach to tell your brain you're full. When you eat fast, it's easy to overeat. "70,weight,,"If you swap a pina colada FOR a mojito, how many calories can you save? ",126kcal; 226kcal; 326kcal; 426kcal,2,Swap a pina colada FOR a mojito and save 326kcal71,weight,,A pint of 5% strength beer contains the same number of calories as: ,packet of McCoyês salted crisps;  a 2 finger Kit Kat; croissant ; packet of Walkers Quavers ,0,"A pint of 5% strength beer = a packet of McCoy's salted crisps (170kcal), 2 finger Kit Kat (107kcal), croissant (406kcal) and Quavers (87kcal) "72,weight,,How many g equal 1 portion of fruit or veg?,80g;100g; 120g; 140g,0,"A portion of fruit or veg is 80g. Fresh, frozen, tinned, dried and juiced fruit and veg all count to- wards your 5 A Day. "73,weight,,How long does it take a 70kg person running 6mph to burn off the calories in a plain bagel?,12 mins; 14 mins; 16 mins; 18 mins; 20 mins,3,"It takes 18 mins to run off a plain bagel, 10 mins to run off buttered brown toast, 12 mins to run off 2 Hob Nob biscuits and 39 mins to burn off 300g of chicken korma with rice"74,weight,,How many calories are in a 100g bag of pork scratchings?,221kcal; 321kcal; 421kcal; 521kcal; 621kcal,4,"There are 621 kcal in a 100g bag of pork scratchings, 300kcal in 50g of roasted and salted peanuts and 209kcal in 2 slices of garlic bread."75,weight,,How many calories are fully loaded nachos (pub meal)?,324kcal; 524kcal; 724kcal; 924kcal; 1124kcal,3,"There are 924 kcal in fully loaded nachos (pub meal), 300kcal in 50g of roasted and salted peanuts and 209kcal in 2 slices of garlic bread."76,weight,,How long does it take to burn off the calories in a Snickers bar (319kcal) when walking (3mph)? ,54 mins; 64 mins; 74 mins; 84 mins; 94 mins,3,"These times are based on a person weighing 70kg. Lighter people will take longer to burn off the same number of calories: walking (3mph): 84min, running (6mph): 28min , cycling (12-14mph): 35min, park football: 39min , breaststroke swim: 28min."77,weight,,Why are low fat foods sometimes not better for you? ,you eat more; often replaced by sugar; replaced by unsaturated fat,1,"These foods aren't necessarily low in calories. Often the fat is replaced with sugar, and the food may end up with the same, or an even higher, energy content. "78,weight,,"What is the main reason for cutting down on alcohol, if you are trying to lose weight?",high in sugar; high in fat; high in fibre,0,"Most people in the UK eat and drink too much sugar. Sugary foods and drinks, including alcoholic drinks, are often high in energy (measured in kilojoules or calories), and could contribute to weight gain. They can also cause tooth decay, especially if eaten between meals. "79,weight,,On average which of the following takeaway options is lowest in calories?,9-10 inch meat/fish pizza; sweet&sour pork w/ egg fried rice; fish & chips; chicken korma w/ pilau rice; chicken shish kebab In pitta,4,The lowest calorie takeaway is the chicken shish at around 356kcal. The most calorific would be the sweet and sour pork at around 1238kcal. 80,weight,,On average which of the following supermarket sandwich options is highest in calories?,"ham and salad; cheese and tomato; prawn mayonnaise; egg mayo and cress; BLT (bacon, lettuce and tomato)",1,Cheese and tomato is generally the highest calorie sandwich at around 472kcal. Prawn mayo is around 350. Ham and salad is generally lowest at around 284kcal.81,sleep,,Which of these could be responsible for a bad nights sleep?,eating meat; smoking; drinking smoothies; exercise ,1,"It's bad for sleep. Smokers take longer to fall asleep, they wake up more frequently, and they often have more disrupted sleep. "82,sleep,,"If you are suffering from a mid-afternoon slump, what should you do?",eat some chocolate;  have an energy drink; drink some water,2,"If you don't drink enough water you'll feel sleepy, be less able to concentrate, and you may get headaches. When you feel hungry you're often actually thirsty. Don't wait to feel thirsty to have a drink. Keep a filled bottle of water on your desk, so that you're more likely to drink regularly, and can see if you're drinking enough."83,sleep,,If you are lacking in energy you should:,try a detox;  take some multivitamins; drink an energy drink; eat a healthy diet,3,"Plain water is a better choice than an energy drink. For a quick surge of energy, snack on fruit such as a banana. "84,sleep,,How many hours should most adults aim for each night?,7 hours; 8 hours;  9 hours; 10+ hours,1,Most of us need around eight hours of good quality sleep a night to function properly   but some need more and some less. You need to find out how much sleep you need and then try to achieve it.85,sleep,,Which of the following shouldnêt you do before going to bed?,have a warm bath; write a  to doî list; read a book; watch TV; light yoga stretches,3,"Winding down is a critical stage in preparing for bed. There are many ways of relaxing. Your bedroom should be a relaxing environment. Experts claim there's a strong association in people's minds between sleep and the bedroom. However, certain things weaken that association, such as TVs and other electronic gadgets, light, noise, and a bad mattress or bed. "86,sleep,,Why might you suffer from winter tiredness?,too cold; lack of sunlight; comfort eating,1,"As the days become shorter, your sleep and waking cycles become disrupted, leading to fatigue. Less sunlight means that your brain produces more of a hormone called melatonin, which makes you sleepy."87,sleep,,Which hormone is responsible for making you sleepy? ,melatonin; thyroxin; amylin; oxytocin,0,"Less sunlight means that your brain produces more of a hormone called melatonin, which makes you sleepy. Because the release of this sleep hormone is linked to light and dark, when the sunsets earlier your body also wants to go to bed earlier   hence you may feel sleepy in the early evening."88,sleep,,"If your sleep suffers due to a partner's snoring, what advice can you give them?",avoid alcohol before going to bed; nothing just kick them;  lie on their back; start smoking,0,"Snoring self-help tips: avoid alcohol before going to bed, healthy weight and diet, sleep on your side, quit smoking and keep your nasal passages clear."89,sleep,,Why is sleep so important to your health?,stops you being moody; stops you snacking;  boosts immunity,2,"If you seem to catch every cold and flu that's going around, your bedtime could be to blame. Prolonged lack of sleep can disrupt your immune system, so you're less able to fend off bugs."90,sleep,,How does sleep help you keep thin?,reduces leptin levels; reduces melatonin levels; reduces insulin levels,0,"It's believed to be because sleep-deprived people have reduced levels of leptin, the chemical that makes you feel full and increased levels of ghrelin, the hunger-stimulating hormone."91,sleep,,Which of the following suggestion will not help you sleep better?,avoid late night caffeine; set regular wake-up times; wear an eye mask; 2 late night glasses of wine ,3,"Too much food or alcohol, especially late at night, can interrupt your sleep patterns. Alcohol may help you to fall asleep initially, but it will disrupt your sleep later on in the night. "92,sleep,,How long does a standard sleep cycle last?,60 mins; 90 mins; 120 mins;,1,"While asleep, your body goes through different sleep stages in a cycle that lasts about 90 minutes. You may go through five cycles in a night."93,sleep,,Which of the following is not known to cause fatigue?,crash dieting; poor posture; whole wheat breakfast; being housebound,2,"Crash dieting:  Very low calorie diets, especially ones that give you less than 850 calories a day, will make you feel even more tired and can damage your health in other ways.  Poor posture:  Bad posture such as hunching forwards and slumping in your seat puts your spine out of alignment. The more out of balance your spine is, the more your muscles have to work in order to compensate. Housebound: Lack of light and fresh air is a key cause of tiredness."94,sleep,,Which of these is an energy sustaining snack?,wholegrain cereal; chocolate; energy drink; coffee,0,"Energy-sustaining snacks: wholegrain cereal with reduced-fat milk, piece of fruit, salad with grilled chicken, hard-boiled egg or lean ham and mustard sandwich on wholemeal bread or low fat yoghurt."95,sleep,,"If you are are struggling with fatigue, you should try to:",lose weight; snack during the day; drink caffeine,0,"If your body is carrying excess weight, it can be exhausting. It also puts extra strain on your heart, which can make you tired. Lose weight and you'll feel much more energetic. Apart from eating healthily, the best way to lose weight is to be more active and do more exercise. "96,sleep,,"If you are are struggling with constantly feeling tired, you may want to try:",regular naps; drink caffeine; counselling,2,There's some evidence that talking therapies such as counselling or cognitive behavioural therapy (CBT) might help to fight fatigue. See your GP for a referral for talking treatment on the NHS or for advice on seeing a private therapist. 97,sleep,,What affect does an underactive thyroid have on feelings of tiredness?,less tired; irrelevant; more tired;,2,"An underactive thyroid gland means that you have too little thyroid hormone (thyroxin) in your body. This makes you feel tired. Youêre also likely to put on weight and have aching muscles. Itês most common in women, and it happens more often as you get older. Your GP can diagnose underactive thyroid by taking a simple blood test. "98,sleep,,"If you are struggling to stay awake at your desk, you should:",drink lots of coffee; drink an energy drink; eat chocolate; desk stretches,3,"Desk stretches: Link your hands, push your arms out in front of you and then raise them above your head. Lift your shoulders up towards your ears and gently roll them backward. Extend your legs in front of you and point and flex your toes. Hug your knees, one at a time, towards your chest."99,sleep,,"If you are struggling to stay focused at your desk, you should:",change work focus; drink lots of coffee; drink an energy drink; eat chocolate,0,"When your work pile seems endless, it can be easy to lose enthusiasm and slip into an energy slump. Breaking your ""to do"" list into small, manageable tasks and taking a short break after each one will help you stay focused. Leave the simple jobs for early afternoon so that you donêt have to concentrate too hard. "100,sleep,,Can oversleeping cause an issue?,no; makes no difference; yes,2,"Oversleeping has been linked to physical problems such as diabetes and heart disease. According to the Mental Health Foundation, oversleeping can occur in 15-40% of people with depression."101,smoking,,9 months after you quit smoking your lung capacity improves by? ,5%; 10%; 15%; 20%,1,People breathe more easily and cough less when they give up smoking because their lung capacity improves by up to 10% within nine months. 102,smoking,m,Men who quit smoking by 30 add how many years to the life?,2 years; 4 years; 6 years;  8 years; 10 years,4,"Half of all long-term smokers die early from smoking-related diseases, including heart disease, lung cancer and chronic bronchitis. Men who quit smoking by 30 add 10 years to their life. Quitting not only adds years to your life, but it also greatly improves the chance of a disease-free, mobile, happier old age. "103,smoking,,People who quit smoking at 60 add how many years to their life?,3 year; 4 years; 5 years; 6 years,0,"People who kick the habit at 60 add three years to their life. In other words, it's never too late to benefit from stopping. Quitting not only adds years to your life, but it also greatly improves the chance of a disease-free, mobile, happier old age. "104,smoking,,Which ingredient in a cigarette causes cancer?,Nicotine; Tar; Acetic Acid,1,"Nicotine doesn't cause cancer. It's the other toxic chemicals in cigarettes, such as tar and carbon monoxide, that damage your health. Nicotine replacement therapy gets nicotine into your body without the dangerous poisons. "105,smoking,,Nicotine replacement products should:,are a waste of time; not be used together; be used in combination,2,"Using more than one product at a time   known as combination therapy   can be a good thing as it often increases your chances of success. A popular strategy is to use nicotine patches to reduce everyday cravings plus a nasal spray, gum, lozenges, inhalator or mouth spray for sudden cravings. "106,smoking,,If you are pregnant should you use nicotine replacement products:,no; now and then; yes ,2,"If you're pregnant, it's a great time to quit as smoking is much more dangerous to you and your baby. Talk to your stop smoking adviser or midwife about your treatment options, as the prescription tablets Champix and Zyban are not recommended in pregnancy. However, NRT products such as patches, gum, lozenges, micro tabs, the inhalator and nasal sprays may be recommended if you're finding it hard to quit. "107,smoking,,The biggest problem with nicotine replacement products is:,not used for long enough; they are addictive; nicotine release is too fast,0,"Most people using nicotine products do not become dependent on them. In fact, the biggest problem with NRT is that people don't use enough of it for long enough. The nicotine from patches, gum and so on is released into your system much more slowly and in a different way than nicotine from a cigarette. Your body absorbs it more slowly and less reaches your brain. "108,smoking,,What should you eat for dinner when trying to give up smoking?,beef burger; lamb meatballs; vegetarian pizza,2,"Is your after-dinner cigarette your favourite? A US study revealed that some foods, including meat, make cigarettes more satisfying. Others, including cheese, fruit and vegetables, make cigarettes taste terrible. So swap your usual steak or burger for a veggie pizza instead. "109,smoking,,Which of the following makes a cigarette taste terrible? ,fizzy drinks; alcohol; cola; tea; fruit juice,4,"The same study looked at drinks. Fizzy drinks, alcohol, cola, tea and coffee all make cigarettes taste better. So when you're out, drink more water and juice. Some people find that simply changing their drink (for example, switching from wine to a vodka and tomato juice), affects their need to reach for a cigarette. "110,smoking,,The combination of smoking and drinking heavily raises your risk of mouth cancer by: ,18 times; 28 times; 38 times; 48 times,2,"The combination of smoking and drinking heavily raises your risk of mouth cancer by 38 times. A craving can last five minutes. Before you give up, make a list of five-minute strategies. For example, you could leave the party for a minute, dance or go to the bar. "111,smoking,,Non-smokers who breathe in second-hand smoke inhale more than:,"500 chemicals;  1,000 chemicals;  4,000 chemicals;  10,000 chemicals",2,"Non-smokers who breathe in second-hand smoke (smoke from other people's cigarettes) inhale more than 4,000 chemicals, at least 50 of which are known to cause cancer. For non-smokers, breathing other people's smoke means an increased risk of lung cancer, heart disease and stroke. "112,smoking,,Children who live with smokers are how many times more likely to develop lung cancer later in life?,2 times; 3 times; 4 times; 5 times;,1,"For children, second-hand smoke three times the risk of getting lung cancer in later life compared with children who live with non- smokers. "113,smoking,,"After 35, every year that you smoke you reduce your life expectancy by: ",1 month; 3 months; 6 months,1,Statistics suggest that every year after 35 that you continue to smoke can take an average of three months off your life. If you quit smoking before the age of 35 you're likely to have a full life expectancy. 114,smoking,,How should you try to reduce weight gain as you give up smoking?,use stop smoking medicines; inevitable side-effect ;  dieting ,0,Stop smoking medicines such as nicotine-replacement therapy and the prescription tablets Zyban (bupropion) and Champix (varenicline) can double your chances of quitting successfully and also seem to help reduce weight gain in the first few months. Studies suggest it's better to tackle stopping smoking first before trying to lose any weight gained while quitting115,smoking,,What fraction of quitter relapse in the presence of smokers? ,1/4; 1/2; 3/4; All;,2,It's also important to stay away from people who smoke. Nearly three quarters of all quitters who relapse do so in the presence of people who are smoking usually after having asked one of them for a cigarette! 116,smoking,,Heavy smokers with diabetes increase their chance of death by:,nothing; 2 times; 3 times; 4 times;,1,Heavy smokers with diabetes have roughly double the chance of death from heart disease or stroke compared with non-smoking diabetics. 117,smoking,,"10 years after quitting, do heavy smokers with diabetes still have an increased chance of death? ",no; yes by 5-10%; 10-30%; 30-40%,2,"People smoking up to 15 cigarettes a day have a 50% higher chance, while ex-smokers have a 10-30% increased chance, even 10 years after quitting. "118,smoking,,Here is a list of consequence of giving up smoking. Which is not true?,improved circulation; improved sense of taste; increased stress levels; weight gain,2,"Scientific studies show that people's stress levels are lower after they stop smoking. Nicotine addiction makes smokers stressed from the Withdrawal between cigarettes. The pleasant feeling of satisfying that craving is only temporary and is not a real cure for stress. Also, the improved levels of oxygen in the body means that ex-smokers can concentrate better and have increased mental wellbeing. "119,smoking,,"After quitting, how long does it take for your lungs to start to clear?",1 day; 1 week; 1 month; 1 year ,0,After 24 hours your lungs start to clear. 120,smoking,,"After quitting, how long does it take for your energy to increase?",2 days; 3 days; 2 weeks; 3 weeks,1,"After three days you can breathe more easily, and your energy increases. "